{
  "kind": "feed-observation",
  "schema_version": 1,
  "example": true,
  "canonicalization": "feltwillow-canonical-json-v1",
  "observation_id": "obs-20261006T190000Z-00000000",
  "show_id": "example-show-en",
  "feed_url": "https://feeds.example.invalid/x.xml",
  "fetched_at": "2026-10-06T19:00:00Z",
  "fetch": null,
  "feed_sha256": "9df376949b59a180e3b730106710d3a6deca8ec5ecadfbf97f0a985b22737377",
  "feed_bytes": 1336,
  "channel": {
    "title": "EXAMPLE Show & Friends",
    "language": "en",
    "itunes_email_present": true,
    "itunes_new_feed_url": null,
    "itunes_block": null,
    "item_count": 2
  },
  "items": [
    {
      "guid": "https://www.example.invalid/ep2",
      "guid_is_permalink": true,
      "guid_permalink_attr_present": false,
      "title": "Second \"Story\" (EXAMPLE)",
      "pubdate_raw": "Tue, 13 Oct 2026 18:00:00 +0200",
      "pubdate_utc": "2026-10-13T16:00:00Z",
      "enclosure": {
        "url": "https://media.example.invalid/ep2.mp3",
        "length": "5500000",
        "type": "audio/mpeg"
      },
      "itunes_duration_raw": "412",
      "itunes_episode_type": "full"
    },
    {
      "guid": "example-host-guid-0001",
      "guid_is_permalink": false,
      "guid_permalink_attr_present": true,
      "title": "The Lion & the Mouse (EXAMPLE)",
      "pubdate_raw": "Tue, 06 Oct 2026 18:00:00 GMT",
      "pubdate_utc": "2026-10-06T18:00:00Z",
      "enclosure": {
        "url": "https://media.example.invalid/ep1-a.mp3",
        "length": "6600000",
        "type": "audio/mpeg"
      },
      "itunes_duration_raw": "412",
      "itunes_episode_type": "full"
    }
  ],
  "problems": []
}
